Sub-theme name,Approved By,Date approved,Decision Notes,Descriptor,Development status,Framework database,Indicators,Practice domain,Status,Temp Filter,Theme database,ToC Stage
Cultural heritage & traditional knowledge safeguarded,,,,"Ensuring that the cultural heritage, traditional knowledge, and practices of Indigenous Peoples and Local Communities are respected, protected, and integrated into project design and implementation. This includes recognizing Indigenous land stewardship, preserving sacred sites, and upholding the rights of communities to maintain and transmit their cultural and ecological knowledge",Approved,,"Are your community’s cultural heritage, traditional knowledge, and practices respected and meaningfully integrated into this project’s design and implementation? (https://www.notion.so/Are-your-community-s-cultural-heritage-traditional-knowledge-and-practices-respected-and-meaningfu-34060bfb014e81928e85e858b63f4fab?pvs=21), Can community members continue their traditional resource use activities — such as harvesting, fishing, grazing, or gathering — within project areas without restriction or new barriers imposed by the project? (https://www.notion.so/Can-community-members-continue-their-traditional-resource-use-activities-such-as-harvesting-fishi-34060bfb014e81d3bfdaee5bcc57a417?pvs=21), Are sacred sites, cultural landscapes, and ceremonial areas in your community’s territory protected from project-related disturbance or damage? (https://www.notion.so/Are-sacred-sites-cultural-landscapes-and-ceremonial-areas-in-your-community-s-territory-protected--34060bfb014e81fc9b5dc79ff4257c3f?pvs=21), Is your community’s traditional knowledge protected from exploitation or use by external actors without your free, prior, and informed consent? (https://www.notion.so/Is-your-community-s-traditional-knowledge-protected-from-exploitation-or-use-by-external-actors-with-34060bfb014e819d92adde0f9103f696?pvs=21)",,Published to site,,User Rights and Land Tenure (https://www.notion.so/User-Rights-and-Land-Tenure-31060bfb014e80289263f60a5c2af35d?pvs=21),1: Output
Caregiver Participation in School Activities,,,,"Covers caregiver attendance at school events, parent meetings, open days, and volunteering. Captures physical presence and active participation in the school community, distinct from communication behaviours. Grounded in Epstein's typology of parental involvement, specifically the volunteering and school involvement dimensions.",Proposed. Pending Go-No Go,,"In the current school term, how often do you read through your child's school diary? (https://www.notion.so/In-the-current-school-term-how-often-do-you-read-through-your-child-s-school-diary-33f60bfb014e81a28a23e7cece66266d?pvs=21), In the current school term, how often do you sign your child's school diary after reading it? (https://www.notion.so/In-the-current-school-term-how-often-do-you-sign-your-child-s-school-diary-after-reading-it-33f60bfb014e81c499cbd989e4f390d7?pvs=21), In the current school term, have you talked about something from your child's school diary with another person, for example a family member, a teacher, or another caregiver? (https://www.notion.so/In-the-current-school-term-have-you-talked-about-something-from-your-child-s-school-diary-with-anot-33f60bfb014e8128ad03c9216aa54044?pvs=21), Who did you talk to, and what did you discuss from the diary? (https://www.notion.so/Who-did-you-talk-to-and-what-did-you-discuss-from-the-diary-33f60bfb014e81e98b0be5c1bfc57a36?pvs=21), In the current school term, did something you read in your child's school diary lead you to do something differently or make a decision about their learning or behaviour? (https://www.notion.so/In-the-current-school-term-did-something-you-read-in-your-child-s-school-diary-lead-you-to-do-somet-33f60bfb014e810ea360c26b8d274977?pvs=21), What did you do or decide, and what in the diary prompted it? (https://www.notion.so/What-did-you-do-or-decide-and-what-in-the-diary-prompted-it-33f60bfb014e81a88fede76ce737c4c3?pvs=21)",,Not Published,Youth Impact,Caregiver engagement in Learning (https://www.notion.so/Caregiver-engagement-in-Learning-31360bfb014e80a1b7f9fec8fc241b1a?pvs=21),2: Outcome
Caregiver Support for Learning at Home,,,,"Covers the home learning environment, homework support, reading with children, and creation of conditions conducive to study. The most direct caregiver influence on learner attainment and consistently the strongest predictor of outcomes in the parental engagement literature. Captures home-based support as a distinct and critical engagement mechanism.",Proposed. Pending Go-No Go,,,,Not Published,Youth Impact,Caregiver engagement in Learning (https://www.notion.so/Caregiver-engagement-in-Learning-31360bfb014e80a1b7f9fec8fc241b1a?pvs=21),2: Outcome
Caregiver Attitudes and Beliefs about Education,,,,"Covers caregiver values, aspirations, and expectations for their child's education. Caregiver beliefs about the value of education are stronger predictors of learner persistence than structural engagement behaviours. Captures the attitudinal preconditions for sustained engagement rather than the behaviours themselves.",Proposed. Pending Go-No Go,,,,Not Published,Youth Impact,Caregiver engagement in Learning (https://www.notion.so/Caregiver-engagement-in-Learning-31360bfb014e80a1b7f9fec8fc241b1a?pvs=21),2: Outcome
Barriers to Caregiver Engagement,,,,"Covers structural, economic, cultural, and social barriers preventing caregivers from engaging, including work schedules, distance, gender norms, and language. A complementary diagnostic subtheme rather than a standalone outcome subtheme. Essential for interpreting low scores on any other caregiver engagement indicator and for informing programme design.",Proposed. Pending Go-No Go,,"Are there any practical difficulties, such as work commitments, distance from the school, or cost of transport, that make it hard for you to be involved in your child's schooling? (https://www.notion.so/Are-there-any-practical-difficulties-such-as-work-commitments-distance-from-the-school-or-cost-of-33f60bfb014e8142a31bef233d5238c2?pvs=21), What are those difficulties, and how do they affect your involvement? (https://www.notion.so/What-are-those-difficulties-and-how-do-they-affect-your-involvement-33f60bfb014e8167a7c8ee3081aaeec8?pvs=21), Do difficulties with language or understanding school communications ever make it harder for you to be involved in your child's schooling? (https://www.notion.so/Do-difficulties-with-language-or-understanding-school-communications-ever-make-it-harder-for-you-to--33f60bfb014e81ceb0f9c84741a366ac?pvs=21), Can you describe the language or communication difficulty and how it affects your involvement? (https://www.notion.so/Can-you-describe-the-language-or-communication-difficulty-and-how-it-affects-your-involvement-33f60bfb014e81c699c0fb8827945cdc?pvs=21), Are there expectations in your community or household about who should or should not be involved in a child's schooling that make it harder for you personally to be involved? (https://www.notion.so/Are-there-expectations-in-your-community-or-household-about-who-should-or-should-not-be-involved-in--33f60bfb014e81e2a2f6cefc48c15d9e?pvs=21), Can you describe those expectations and how they affect your involvement in your child's schooling? (https://www.notion.so/Can-you-describe-those-expectations-and-how-they-affect-your-involvement-in-your-child-s-schooling-33f60bfb014e8170bb64d5d628f1894c?pvs=21)",,Not Published,Youth Impact,Caregiver engagement in Learning (https://www.notion.so/Caregiver-engagement-in-Learning-31360bfb014e80a1b7f9fec8fc241b1a?pvs=21),2: Outcome
Caregiver Confidence and Capacity to Engage,,,,"Covers caregiver self-efficacy in supporting learning, including literacy, numeracy, and confidence to interact with school staff. Captures programme effects on caregiver empowerment as a condition for engagement, particularly relevant in low-literacy contexts where willingness to engage may exist but skills or confidence are barriers.",Proposed. Pending Go-No Go,,,,Not Published,Youth Impact,Caregiver engagement in Learning (https://www.notion.so/Caregiver-engagement-in-Learning-31360bfb014e80a1b7f9fec8fc241b1a?pvs=21),2: Outcome
Caregiver Wellbeing and Resilience,,,,"Covers caregiver mental health, stress levels, and personal resilience as determinants of the quality and consistency of care and learning support they can provide. A caregiver who is overwhelmed, burnt out, or experiencing chronic stress cannot engage meaningfully with their child's education regardless of their knowledge, attitudes, or skills. This subtheme captures the personal resource dimension of caregiver empowerment and is a documented upstream determinant of child learning outcomes in adverse childhood experience and family resilience literature.",Proposed. Pending Go-No Go,,"How much do you agree with this statement: Even when things are difficult, I believe I can find a way to improve the situation for my child. (https://www.notion.so/How-much-do-you-agree-with-this-statement-Even-when-things-are-difficult-I-believe-I-can-find-a-wa-33f60bfb014e81828d69c2e5ba7b2fa7?pvs=21), How much do you agree with this statement: I can think of specific things I can do to help my child have better opportunities in life. (https://www.notion.so/How-much-do-you-agree-with-this-statement-I-can-think-of-specific-things-I-can-do-to-help-my-child--33f60bfb014e81ccb0f2d8aaee640540?pvs=21), In the past month, how often have you felt that the difficulties in your life were piling up so high that you could not manage them? (https://www.notion.so/In-the-past-month-how-often-have-you-felt-that-the-difficulties-in-your-life-were-piling-up-so-high-33f60bfb014e81abaeb5c7bfbae073d4?pvs=21), In the past month, how often have you felt unable to control the important things in your life? (https://www.notion.so/In-the-past-month-how-often-have-you-felt-unable-to-control-the-important-things-in-your-life-33f60bfb014e8186a5f4c2935613011c?pvs=21), In the past month, how often have you felt that things were going your way and that you were able to handle what life was asking of you? (https://www.notion.so/In-the-past-month-how-often-have-you-felt-that-things-were-going-your-way-and-that-you-were-able-to-33f60bfb014e81d7884fde6283bef042?pvs=21), Is there at least one person in your life you can turn to for practical help or emotional support when things are difficult for you as a caregiver? (https://www.notion.so/Is-there-at-least-one-person-in-your-life-you-can-turn-to-for-practical-help-or-emotional-support-wh-33f60bfb014e8148a375e2550fca31bb?pvs=21), Who is that person or those people, and what kind of support do they give you? (https://www.notion.so/Who-is-that-person-or-those-people-and-what-kind-of-support-do-they-give-you-33f60bfb014e81ddbbf0f2146ef76b28?pvs=21), How much do you agree with this statement: When something goes wrong in my life, I am usually able to get back on track after a while. (https://www.notion.so/How-much-do-you-agree-with-this-statement-When-something-goes-wrong-in-my-life-I-am-usually-able-t-33f60bfb014e817283f6f0c3a0f9e81c?pvs=21), How much do you agree with this statement: When I face a hard situation, I can usually find something useful or meaningful in it. (https://www.notion.so/How-much-do-you-agree-with-this-statement-When-I-face-a-hard-situation-I-can-usually-find-somethin-33f60bfb014e812c9fbad31895099c59?pvs=21), How much do you agree with this statement: I have inner strength that helps me get through difficult times. (https://www.notion.so/How-much-do-you-agree-with-this-statement-I-have-inner-strength-that-helps-me-get-through-difficult-33f60bfb014e81699d52e69cc2d96f0e?pvs=21)",,Not Published,Youth Impact,Caregiver  Learning & Empowerment (https://www.notion.so/Caregiver-Learning-Empowerment-31360bfb014e804da3a6fc38406c31d0?pvs=21),2: Outcome
Caregiver Empowerment and Agency,,,,"Covers the degree to which caregivers feel a sense of personal agency, voice, and capacity to make informed decisions that affect their child's education and wellbeing. Distinct from task-specific confidence in homework support and from peer support participation. Captures whether caregivers see themselves as active agents in their child's educational journey rather than passive recipients of school and programme decisions. Grounded in Freire's critical pedagogy and Malhotra and Schuler's empowerment framework.",Proposed. Pending Go-No Go,,"How much do you agree with this statement: Together with other caregivers in this programme, I feel we have the ability to make a difference in our school or community. (https://www.notion.so/How-much-do-you-agree-with-this-statement-Together-with-other-caregivers-in-this-programme-I-feel--33f60bfb014e81e1bbabe4c5d5e7362f?pvs=21), How much do you agree with this statement: When caregivers in this programme speak up together, people listen to us. (https://www.notion.so/How-much-do-you-agree-with-this-statement-When-caregivers-in-this-programme-speak-up-together-peop-33f60bfb014e81749f94f9a7ac15ad30?pvs=21), How much do you agree with this statement: Being part of this programme has made me feel more connected to other caregivers who share my concerns. (https://www.notion.so/How-much-do-you-agree-with-this-statement-Being-part-of-this-programme-has-made-me-feel-more-connec-33f60bfb014e81eab244e71b9608ab6f?pvs=21), How much do you agree with this statement: I have a say in decisions about my child's education. (https://www.notion.so/How-much-do-you-agree-with-this-statement-I-have-a-say-in-decisions-about-my-child-s-education-33f60bfb014e81c08a84f2d5046f7f82?pvs=21), How much do you agree with this statement: When I share my views about my child's schooling, they are taken seriously. (https://www.notion.so/How-much-do-you-agree-with-this-statement-When-I-share-my-views-about-my-child-s-schooling-they-ar-33f60bfb014e81d2a4d6f58c3370c6f2?pvs=21), How much do you agree with this statement: I feel like an active participant in decisions about my child's education, not just someone who is told what has been decided. (https://www.notion.so/How-much-do-you-agree-with-this-statement-I-feel-like-an-active-participant-in-decisions-about-my-c-33f60bfb014e8167af26ccb014752591?pvs=21), When decisions are made in your household about things that affect your child's schooling, such as whether they attend, what activities they do, or how household resources are used, do you have a say in those decisions? (https://www.notion.so/When-decisions-are-made-in-your-household-about-things-that-affect-your-child-s-schooling-such-as-w-33f60bfb014e81039c69e1fb1d6a1389?pvs=21), Can you give an example of a decision about your child's schooling that you had a say in recently? (https://www.notion.so/Can-you-give-an-example-of-a-decision-about-your-child-s-schooling-that-you-had-a-say-in-recently-33f60bfb014e81b58863e4d30fab8a2e?pvs=21), How much do you agree with this statement: I feel confident choosing between different options for my child's education or learning support. (https://www.notion.so/How-much-do-you-agree-with-this-statement-I-feel-confident-choosing-between-different-options-for-m-33f60bfb014e8165a339e1da201882ad?pvs=21), How much do you agree with this statement: I feel confident recognising when my child needs extra help with their learning and knowing where to go for support. (https://www.notion.so/How-much-do-you-agree-with-this-statement-I-feel-confident-recognising-when-my-child-needs-extra-he-33f60bfb014e819185d5d4205f41789e?pvs=21), How much do you agree with this statement: Even when others in my household disagree, I feel able to stand by decisions I have made about my child's schooling. (https://www.notion.so/How-much-do-you-agree-with-this-statement-Even-when-others-in-my-household-disagree-I-feel-able-to-33f60bfb014e8105a8e9c7520f65e319?pvs=21)",,Not Published,Youth Impact,Caregiver  Learning & Empowerment (https://www.notion.so/Caregiver-Learning-Empowerment-31360bfb014e804da3a6fc38406c31d0?pvs=21),2: Outcome
Civic Engagement and Active Citizenship,,,,"Covers the degree to which young people participate in civic processes beyond programme-structured settings, including community governance structures, local decision-making bodies, public consultations, civic advocacy, and community accountability mechanisms. Distinct from peer leadership, which is relational and peer-directed, and from community service, which is activity-based. Civic engagement captures whether young people are developing as active citizens who can navigate and influence formal civic structures. Grounded in Youniss, Flanagan, and Checkoway's civic development literature.",Proposed. Pending Go-No Go,,"Can you name at least three basic rights that you have as a young person in your community, for example rights related to education, safety, or being heard? (https://www.notion.so/Can-you-name-at-least-three-basic-rights-that-you-have-as-a-young-person-in-your-community-for-exam-33f60bfb014e8164a1bbc2b072d38fd4?pvs=21), Please name those rights, and is there a place or person in your community you could go to if one of your rights was not being respected? (https://www.notion.so/Please-name-those-rights-and-is-there-a-place-or-person-in-your-community-you-could-go-to-if-one-of-33f60bfb014e81209564f2e14f313ee9?pvs=21), In the past 12 months, have you taken part in any formal civic activity that exists in your community independently of this programme, for example a youth council, a community meeting, a voting process, or a community forum? (https://www.notion.so/In-the-past-12-months-have-you-taken-part-in-any-formal-civic-activity-that-exists-in-your-communit-33f60bfb014e81069546ff98a25a6fb4?pvs=21), What was it, and what did you do or say there? (https://www.notion.so/What-was-it-and-what-did-you-do-or-say-there-33f60bfb014e81db9a00c8f0c1e3f651?pvs=21), In the past 12 months, have you raised a concern or problem affecting your community through a formal channel, for example at a meeting, through a school or community representative, or through an official complaint process? (https://www.notion.so/In-the-past-12-months-have-you-raised-a-concern-or-problem-affecting-your-community-through-a-forma-33f60bfb014e8192ad09e9c302bba5f9?pvs=21), What was the concern, and how did you raise it? (https://www.notion.so/What-was-the-concern-and-how-did-you-raise-it-33f60bfb014e8114bffac30920ec6e66?pvs=21), How much do you agree with this statement: Young people like me can make a real difference in our community. (https://www.notion.so/How-much-do-you-agree-with-this-statement-Young-people-like-me-can-make-a-real-difference-in-our-co-33f60bfb014e81db9547ca9495bef51f?pvs=21), How much do you agree with this statement: I feel a responsibility to do something when I see a problem in my community. (https://www.notion.so/How-much-do-you-agree-with-this-statement-I-feel-a-responsibility-to-do-something-when-I-see-a-prob-33f60bfb014e8189854ae1cdf48909dc?pvs=21), How much do you agree with this statement: I feel that young people are welcome to be part of how decisions are made in this community. (https://www.notion.so/How-much-do-you-agree-with-this-statement-I-feel-that-young-people-are-welcome-to-be-part-of-how-de-33f60bfb014e815fa45ecb3891699800?pvs=21)",,Not Published,Youth Impact,Contribution  & Leadership (https://www.notion.so/Contribution-Leadership-31360bfb014e803bb46adaced67ed396?pvs=21),2: Outcome
Recognition and Visibility of Youth Contribution,,,,"Covers whether youth contributions, ideas, and leadership are formally acknowledged, made visible to the broader community, and positioned as credible and valued by adults and institutions. Recognition is distinct from contribution as a behaviour and captures the structural and relational conditions that sustain youth engagement over time. Whether youth feel seen and valued as contributors is a documented predictor of civic identity development, sustained participation, and resilience against marginalisation, particularly for young people from underrepresented or excluded groups.",Proposed. Pending Go-No Go,,"In the past 12 months, has an adult, organisation, or community figure formally recognised or acknowledged something you contributed or led, for example through a certificate, a public mention, an award, or an official thank you? (https://www.notion.so/In-the-past-12-months-has-an-adult-organisation-or-community-figure-formally-recognised-or-acknow-33f60bfb014e810ca495e4fbea9e59f2?pvs=21), Who recognised you, what was it for, and how was it recognised? (https://www.notion.so/Who-recognised-you-what-was-it-for-and-how-was-it-recognised-33f60bfb014e81b3b2aec4c91549587a?pvs=21), In the past 12 months, was something you did or led shared with or presented to people outside your immediate group or class, for example at a community event, in a school assembly, through social media, or in a public display? (https://www.notion.so/In-the-past-12-months-was-something-you-did-or-led-shared-with-or-presented-to-people-outside-your--33f60bfb014e813e9564e4e36b36c541?pvs=21), What was shared, who saw it, and where or how was it shown? (https://www.notion.so/What-was-shared-who-saw-it-and-where-or-how-was-it-shown-33f60bfb014e819ca7dcc81ec46224ea?pvs=21), How much do you agree with this statement: The adults and organisations around me notice when young people contribute something meaningful. (https://www.notion.so/How-much-do-you-agree-with-this-statement-The-adults-and-organisations-around-me-notice-when-young--33f60bfb014e81aebd4ad20d19cc4424?pvs=21), How much do you agree with this statement: When young people in this programme lead something, their leadership is valued and taken seriously. (https://www.notion.so/How-much-do-you-agree-with-this-statement-When-young-people-in-this-programme-lead-something-their-33f60bfb014e81afbcdae668cea8e5cb?pvs=21), How much do you agree with this statement: I feel that my own contributions and efforts are seen and appreciated by the people around me. (https://www.notion.so/How-much-do-you-agree-with-this-statement-I-feel-that-my-own-contributions-and-efforts-are-seen-and-33f60bfb014e812eaf71d342515a4c09?pvs=21)",,Not Published,Youth Impact,Contribution  & Leadership (https://www.notion.so/Contribution-Leadership-31360bfb014e803bb46adaced67ed396?pvs=21),2: Outcome
Cross-Sector Coordination and Referral,,,,"Covers how different actors operating in the same community or programme area, including schools, health services, social protection systems, NGOs, community structures, and government agencies, coordinate referrals and joint case management for learners and families with complex or intersecting needs. Distinct from partner alignment, which concerns strategic and evidential coordination. Cross-sector coordination and referral captures the operational interface between systems at the point of delivery.",Proposed. Pending Go-No Go,,"Do you know of a documented referral pathway for connecting a learner or family to a service from a different sector, for example health, social protection, or justice? (https://www.notion.so/Do-you-know-of-a-documented-referral-pathway-for-connecting-a-learner-or-family-to-a-service-from-a--34060bfb014e817ca612f465f3e6c033?pvs=21), Which sector is the pathway for, and what is the referral process or contact? (https://www.notion.so/Which-sector-is-the-pathway-for-and-what-is-the-referral-process-or-contact-34060bfb014e81ad823ce4696e5b24a3?pvs=21), How much do you agree with this statement: I am aware of the referral pathways available for learners or families who need support from outside my sector. (https://www.notion.so/How-much-do-you-agree-with-this-statement-I-am-aware-of-the-referral-pathways-available-for-learner-34060bfb014e81b68033dc92f7c471bb?pvs=21), How much do you agree with this statement: I feel confident making a referral to another sector when a learner or family needs support I cannot provide. (https://www.notion.so/How-much-do-you-agree-with-this-statement-I-feel-confident-making-a-referral-to-another-sector-when-34060bfb014e816d8aceec454ee2c33c?pvs=21), How much do you agree with this statement: When I refer a learner or family to another sector, I trust that they will receive a follow-up response. (https://www.notion.so/How-much-do-you-agree-with-this-statement-When-I-refer-a-learner-or-family-to-another-sector-I-tru-34060bfb014e8104b95dd22603bb640d?pvs=21), In the past 12 months, have you taken part in a joint discussion or review about a specific learner or family with a practitioner from a different sector, for example a health worker, a social worker, or a justice officer? (https://www.notion.so/In-the-past-12-months-have-you-taken-part-in-a-joint-discussion-or-review-about-a-specific-learner--34060bfb014e816c9ef9e75b7d921402?pvs=21), What sector was the other practitioner from, and what was the discussion about? (https://www.notion.so/What-sector-was-the-other-practitioner-from-and-what-was-the-discussion-about-34060bfb014e8126bf38d9bf4079fe06?pvs=21)",,Not Published,Youth Impact,Coordination  & Collective Learning (https://www.notion.so/Coordination-Collective-Learning-31360bfb014e802d864de4e4e785ae47?pvs=21),1: Output
