Sub-theme name,Approved By,Date approved,Decision Notes,Descriptor,Development status,Framework database,Indicators,Practice domain,Status,Temp Filter,Theme database,ToC Stage
"Collective Efficacy and Community Solidarity
    ",,,,Confidence that the community can work together to solve shared problems.,Approved,,"How confident are you that your community could organise and work together effectively to solve a serious shared problem — such as managing water shortages, preventing illegal encroachment, or addressing a community conflict? (https://www.notion.so/How-confident-are-you-that-your-community-could-organise-and-work-together-effectively-to-solve-a-se-34060bfb014e81cea05dfdcebb0246e2?pvs=21), Can you give an example of a time when your community successfully came together to solve a shared challenge or take collective action for the common good? (https://www.notion.so/Can-you-give-an-example-of-a-time-when-your-community-successfully-came-together-to-solve-a-shared-c-34060bfb014e8164be75fdf8e9be31ac?pvs=21), Are there community members who feel excluded from or negatively affected by this project in ways that are creating tensions or divisions? (https://www.notion.so/Are-there-community-members-who-feel-excluded-from-or-negatively-affected-by-this-project-in-ways-th-34060bfb014e8153a3aed92e7c953642?pvs=21), How strong is the sense of community solidarity in your area — do people regularly come together for collective activities and share a sense of common purpose? (https://www.notion.so/How-strong-is-the-sense-of-community-solidarity-in-your-area-do-people-regularly-come-together-for-34060bfb014e816ab267f5ddb94bddd9?pvs=21), If your community faced a serious shared problem — such as a natural disaster, environmental threat, or community conflict — how confident are you that people would come together effectively to resolve it? (https://www.notion.so/If-your-community-faced-a-serious-shared-problem-such-as-a-natural-disaster-environmental-threat--34060bfb014e8131b49de0d46b064493?pvs=21), Can you give a recent example of your community coming together to successfully solve a shared problem or challenge? (https://www.notion.so/Can-you-give-a-recent-example-of-your-community-coming-together-to-successfully-solve-a-shared-probl-34060bfb014e81809adbc6522f03a742?pvs=21), Is there a strong sense of shared identity, belonging, and solidarity in your community — a feeling that ‘we are in this together’? (https://www.notion.so/Is-there-a-strong-sense-of-shared-identity-belonging-and-solidarity-in-your-community-a-feeling--34060bfb014e816e9e2dc32cdb541e71?pvs=21), Has this project strengthened your community’s collective ability to work together and take action on shared challenges? (https://www.notion.so/Has-this-project-strengthened-your-community-s-collective-ability-to-work-together-and-take-action-o-34060bfb014e814b9e78f8bf333b6c9a?pvs=21)",,Published to site,SMRV,Social Cohesion and Strengthened Social Capital (https://www.notion.so/Social-Cohesion-and-Strengthened-Social-Capital-31060bfb014e803fa898d77cdce15ae5?pvs=21),2: Outcome
Perceived Importance and Value of Improved Reliability of Essential Public Services,Kate McAlpine,"March 6, 2026",,"This sub-theme captures stakeholder perceptions of the importance, significance, and lived value of improved reliability, functionality, and sustained accessibility of essential public services - including education, healthcare, and water.",Approved,,,Social Value,Published to site,,Social Valuation (https://www.notion.so/Social-Valuation-31860bfb014e80e39a59f0bb8b78a09d?pvs=21),2: Outcome
Perceived Importance and Value of Increased Village-Level Economic Activity,Kate McAlpine,"March 6, 2026",,This sub-theme captures stakeholder perceptions of the importance and value of increased village-level economic activity associated with the presence of salaried staff and expanded service provision.,Approved,,,Social Value,Published to site,,Social Valuation (https://www.notion.so/Social-Valuation-31860bfb014e80e39a59f0bb8b78a09d?pvs=21),2: Outcome
Perceived Importance and Value of Improved School Attendance and Participation,Kate McAlpine,"March 6, 2026",,This sub-theme captures stakeholder perceptions of the importance and value of improved school attendance and consistent participation associated with school feeding and related educational support.,Approved,,,Social Value,Published to site,,Social Valuation (https://www.notion.so/Social-Valuation-31860bfb014e80e39a59f0bb8b78a09d?pvs=21),2: Outcome
Perceived Importance and Value of Reduced Caregiving Burden,Kate McAlpine,"March 6, 2026",,"This sub-theme captures stakeholder perceptions of the importance and value of reduced or redistributed caregiving responsibilities within households, and the extent to which changes in care burden alter how time is allocated.
",Approved,,,Social Value,Published to site,,Social Valuation (https://www.notion.so/Social-Valuation-31860bfb014e80e39a59f0bb8b78a09d?pvs=21),2: Outcome
"Perceived Importance and Value of Increased Household Income
",Kate McAlpine,"March 6, 2026",,"This sub-theme captures stakeholder perceptions of the importance and value of increases in household income resulting from expanded income-generating activities, including those enabled through access to community-based savings and credit mechanisms.",Approved,,,Social Value,Published to site,,Social Valuation (https://www.notion.so/Social-Valuation-31860bfb014e80e39a59f0bb8b78a09d?pvs=21),2: Outcome
"Perceived Importance and Value of Increased Reliability of Farming Conditions
",Kate McAlpine,"March 6, 2026",,"This sub-theme captures stakeholder perceptions of the importance and value of increased reliability of farming conditions, including greater confidence in seasonal timing and crop yields.
",Approved,,,Social Value,Published to site,,Social Valuation (https://www.notion.so/Social-Valuation-31860bfb014e80e39a59f0bb8b78a09d?pvs=21),2: Outcome
Perceived Importance and Value of Improved Household Health,Kate McAlpine,"March 6, 2026",,"This sub-theme captures stakeholder perceptions of the importance and value of improvements in personal or household health associated with increased access to preventative and local healthcare services, including earlier treatment, improved maternal health, and reduced severity of illness.",Approved,,,Social Value,Published to site,,Social Valuation (https://www.notion.so/Social-Valuation-31860bfb014e80e39a59f0bb8b78a09d?pvs=21),2: Outcome
Perceived Fairness of Benefit Distribution Within the Village,Kate McAlpine,"March 6, 2026",,"This sub-theme captures stakeholder perceptions of whether the benefits associated with an intervention are distributed equitably among households or community members, including whether any groups are perceived to be favoured or disadvantaged.
",Approved,,,Social Legitimacy Assessment,Published to site,,Social Legitimacy (https://www.notion.so/Social-Legitimacy-31860bfb014e80cda468ec6727530176?pvs=21),2: Outcome
Perceived Inclusiveness and Representation in Village Decision-Making,Kate McAlpine,"March 6, 2026",,"This sub-theme captures stakeholder perceptions of whether decision-making processes related to an intervention are inclusive, representative, and allow meaningful participation across different groups.
",Approved,,,Social Legitimacy Assessment,Published to site,,Social Legitimacy (https://www.notion.so/Social-Legitimacy-31860bfb014e80cda468ec6727530176?pvs=21),2: Outcome
Perceived Trust in Implementers,Kate McAlpine,"March 6, 2026",,"This sub-theme captures stakeholder perceptions of the integrity, reliability, and good faith of those responsible for implementing the intervention.",Approved,,,Social Legitimacy Assessment,Published to site,,Social Legitimacy (https://www.notion.so/Social-Legitimacy-31860bfb014e80cda468ec6727530176?pvs=21),2: Outcome
Perceived Continuity of the Intervention and Its Benefits,Kate McAlpine,"March 6, 2026",,"This construct captures stakeholder perceptions of whether the intervention, its associated benefits, and the rules governing it are likely to continue over time without interruption, sudden change, or withdrawal.",Approved,,,Social Legitimacy Assessment,Published to site,,Social Legitimacy (https://www.notion.so/Social-Legitimacy-31860bfb014e80cda468ec6727530176?pvs=21),2: Outcome
Perceived Social Burdens and Tensions Associated with the Intervention,Kate McAlpine,"March 6, 2026",,"This sub-theme captures stakeholder perceptions of social burdens, restrictions, or tensions associated with an intervention, including concerns about conflict, exclusion, or negative social consequences.",Approved,,,Social Legitimacy Assessment,Published to site,,Social Legitimacy (https://www.notion.so/Social-Legitimacy-31860bfb014e80cda468ec6727530176?pvs=21),2: Outcome
